{
  "baseline_sha256": "8130f47caa5decf4e1df5343f405fcc79ff18f6d7c6e1880d7e56733d45ae20b",
  "canonical_repair_owner": "src/presentation_agent/deckcompiler/qa/reconstruction_source/slides.js",
  "created_at": "2026-07-22T10:25:25.265696+09:00",
  "current_wave": 1,
  "direct_final_html_patch": false,
  "direct_final_pptx_patch": false,
  "evidence_binding_change": false,
  "expected_repaired_sha256": "8130f47caa5decf4e1df5343f405fcc79ff18f6d7c6e1880d7e56733d45ae20b",
  "faulty_sha256": "ed30ddbd3f390b705a1e90bb134d93c33496b32decc3d21473b5221991cc781c",
  "finding_ids": [
    "VISUAL_TEXT_OFF_CANVAS_SLIDE_001"
  ],
  "fixture_id": "phase6-fixture-text-off-canvas-slide-001",
  "invalidated_artifact_ids": [
    "generated_runtime_source",
    "handoff_project",
    "project_crop_plan",
    "asset_manifest",
    "per_slide_crop_evidence",
    "reconstruction_manifest",
    "pptx",
    "html",
    "powerpoint_renders",
    "html_screenshots",
    "pptx_raster_evidence",
    "html_screenshot_evidence",
    "objective_evidence",
    "reconstruction_score",
    "official_final_gate_report",
    "external_qa_output",
    "external_reconciliation",
    "semantic_qa",
    "source_coverage_qa",
    "creative_qa",
    "editability_qa",
    "visual_qa",
    "raster_crop_qa",
    "parity_qa",
    "contact_sheet",
    "composite_report",
    "acceptance_report"
  ],
  "maximum_outer_waves": 3,
  "plan_hash": "66774f6af9d3c3ac4ba6bd84b53d64d63101d181bc77c8757862db8dbeb1edd9",
  "plan_id": "repair_plan_468174b2bb4b84615911",
  "repair_action": "rematerialize_canonical_owner",
  "schema_name": "phase6_repair_plan",
  "schema_version": "1.0.0",
  "semantic_content_change": false,
  "source_commit": "21bcd35e5919dc340e01be74ced0a51f23931f08",
  "source_detection_report_hash": "a22bd6eaf48448e8efa82c6fd49b2b59e65674b8b87083db5a447560fe6dd0f1",
  "source_detector": "DeckCompiler composite QA",
  "source_fault_application_hash": "99b7da1c4878823346c01dcabe3a4d2029694b40c24322a6261f395a34177ded",
  "source_fixture_hash": "396528a39f557654f0b2880f2a316970e0ca91834398e6f469560de8dc277ec5",
  "source_repair_contract_hash": "8de3a1ae4488cef65d49ca3a2c3d9c0523b230038ff78f50c7d362f797637505",
  "target_field": "#/functions/s1/recommended_decision_body/x",
  "timezone": "Asia/Seoul",
  "visual_target_change": false
}
